id,airdate,episode_number,image_path,name,season,synopsis
551,2014-05-11,551,/episode/551.webp,Pay Pal,25,"John Oliver guest stars as Booth Wilkes-John, a neighbor whom Marge has never met — and doesn't want to meet since Homer insulted them like he always does with new neighbors, but Marge reconsiders when Lisa decides to go friendless."
552,2014-05-18,552,/episode/552.webp,The Yellow Badge of Cowardge,25,"With a little help from Nelson taking out pre-race favorite Milhouse, Bart wins the annual Springfield Elementary ""Last Day of School Race Around the School,"" but doesn't feel proud of it. Meanwhile, Homer tries to bring back the Fourth of July town picnic after the town cancels it due to budget cuts."
553,2014-09-28,553,/episode/553.webp,Clown in the Dumps,26,"After being insulted at a Comedy Central-style roast and having his father die before he can tell him whether or not he was ever funny, Krusty decides to, once again, leave show business (this time out of heartbreak). Meanwhile, Lisa worries that Homer's destructive antics may cost him his life (even though it hasn't so far and probably never will)."
554,2014-10-05,554,/episode/554.webp,The Wreck of the Relationship,26,"Homer and Bart try to, once again, fix their father-son relationship; this time, by going on a trust-building sea excursion. Meanwhile, Marge takes over for Homer's fantasy football league."
555,2014-10-12,555,/episode/555.webp,Super Franchise Me,26,"Marge opens a sandwich franchise store after her sandwiches become a huge success at Springfield Elementary School. But running day-to-day at the store proves challenging, especially when the same franchise opens another location across the street."
556,2014-10-19,556,/episode/556.webp,Treehouse of Horror XXV,26,
557,2014-11-02,557,/episode/557.webp,Opposites A-Frack,26,"Lisa sends Democratic Assembly woman Maxine Lombard to stop Mr. Burns' latest environmentally destructive project, but the two end up in love. Meanwhile, Patty and Selma stay with The Simpsons, but Homer won't let them smoke."
558,2014-11-09,558,/episode/558.webp,Simpsorama,26,"When a time capsule containing a sandwich with Bart's germs, Milhouse's rabbit's foot, and radioactive ooze causes a major catastrophe in the future, Bender of the Planet Express crew travels through time to kill Homer in order to stop the mess from happening."
559,2014-11-16,559,/episode/559.webp,Blazed and Confused,26,"In the continuing saga of Springfield Elementary replacing Mrs. Krabappel as Bart's fourth grade teacher (to coincide with the death of Mrs. Krabappel's voice actress, Marcia Wallace), Superintendent Chalmers picks Mr. Lassen, a soft-spoken psychotic man from Shelbyville, who has it in for Bart. Meanwhile, the Simpsons end up vacationing at a desert festival called Blazing Guy, and Mr. Lassen decides to get rid of Bart once and for all."
560,2014-11-23,560,/episode/560.webp,Covercraft,26,"Homer has a mid-life crisis, takes up bass guitar and forms a cover band with some of the other dads in town. But the band's modest early success is soon overwhelmed by the breakout potential of their most unlikely star, Apu."
561,2014-12-07,561,/episode/561.webp,I Won't Be Home for Christmas,26,"Marge kicks Homer out of the house after Moe convinces him to stay out all night on Christmas Eve at his tavern. Depressed after his brutal divorce by his wife, Homer takes a lonely walk through Springfield instead of being with his family."
562,2015-01-04,562,/episode/562.webp,The Man Who Came to Be Dinner,26,"The Simpsons go to Diz-Nee-Land where the lines for the rides are terrible, except for a rocket called ""Rocket to Your Doom"" that takes them to the home planet of Kang and Kodos, Rigel VII where the inhabitants try to eat Homer in a giant fondue."
563,2015-01-11,563,/episode/563.webp,Bart's New Friend,26,
564,2015-01-25,564,/episode/564.webp,The Musk Who Fell to Earth,26,"When billionaire investor Elon Musk lands in Springfield, he and Homer become fast friends and revolutionize the town's nuclear power plant. But when Musk goes overboard and Mr. Burns wants him removed, Homer must figure out a way to break up with him."
565,2015-02-08,565,/episode/565.webp,Walking Big & Tall,26,"Marge tries to get Homer to lose weight. But instead, he finds a support group that encourages him to embrace his largeness. The subplot is that Springfield has an anthem that every American city had dibs on it, so Bart and Lisa plan to write a new anthem."
566,2015-02-15,566,/episode/566.webp,My Fare Lady,26,"Marge assigns a list of places for her and Homer to drive the kids around Springfield. However, Homer backs out of the chore and sneaks off to Moe's, leaving Marge to drive the kids by herself. Marge drives Bart to his baseball game, Lisa to her band rehearsal, and Maggie to several birthday parties."
567,2015-03-01,567,/episode/567.webp,The Princess Guide,26,
568,2015-03-08,568,/episode/568.webp,Sky Police,26,
569,2015-03-15,569,/episode/569.webp,Waiting for Duffman,26,
570,2015-04-19,570,/episode/570.webp,Peeping Mom,26,"Bart gives false information about his participation in a bulldozer crash, so Marge plans to pursue and punishes Bart for 45 days everywhere until he tells the truth. Meanwhile, Homer ignores Santa's Little Helper when Flanders gets a new dog."
571,2015-04-26,571,/episode/571.webp,The Kids Are All Fight,26,"When Homer gets an old film roll developed, the family takes a trip down memory lane to see the origins of how Bart and Lisa first started getting along with each other."
572,2015-05-03,572,/episode/572.webp,Let's Go Fly a Coot,26,"The Simpsons learn about Grampa's stories in the Air Force. Also, in order to impress Milhouse's Dutch cousin Annika, Bart plans to smoke electronic cigarettes."
573,2015-05-10,573,/episode/573.webp,Bull-E,26,"After Bart gets bullied at the school dance, Marge convinces the town to pass anti-bullying legislation. Homer then gets arrested and sent to rehab for bullying Ned, only to subsequently leave rehab as a hero."
574,2015-05-17,574,/episode/574.webp,Mathlete's Feat,26,"When a modernized Springfield Elementary has a technical meltdown, Lisa transforms it into a Waldorf school. Meanwhile, Groundskeeper Willie becomes the coach of the mathletes. When Lisa and the other kids on the Springfield Elementary Mathlympics Team compete against Waverly Hills Elementary, they instantly get help from a natural genius who uses ancient techniques to compute geometric figures and helps the Mathletes."
575,2015-09-27,575,/episode/575.webp,Every Man's Dream,27,"Homer is diagnosed with narcolepsy, but instead of getting his prescription medication, he comes home drunk. Homer and Marge visit a marriage counselor and have a trial separation, during which Homer begins dating a twenty something pharmacist, something that he soon regrets."
576,2015-10-04,576,/episode/576.webp,Cue Detective,27,"Scotty Boom, a Chew Network super-chef, challenges Homer to a smoke-off. But when someone steals Homer’s secret gadget – a smoker he purchased from a mysterious man at a barbecue shack – Lisa and Bart are on the case."
577,2015-10-11,577,/episode/577.webp,Puffless,27,"After learning that their father really died of lung cancer, Selma and Patty agree to quit smoking. When Selma relapses, Patty moves in with Marge and Homer. Meanwhile, Maggie finds animals on the roof and befriends them."
578,2015-10-18,578,/episode/578.webp,Halloween of Horror,27,"When Lisa becomes frightened at the Krustyland Halloween Horror Night, Homer is forced to take down his Everscream Terrors decorations. Halloween pop-up employees seek vengeance on Homer for causing them to lose their jobs, and rob the family house while Homer and Lisa take shelter in the attic. Homer and Lisa light the stored holiday decorations to attract attention and stand up to the intruders. Meanwhile, Marge takes Bart out for trick-or-treating only to discover that it is too late."
579,2015-10-25,579,/episode/579.webp,Treehouse of Horror XXVI,27,"Wanted: Dead, Then Alive - Sideshow Bob finally kills Bart, but he is uncertain about what to do with his life after completing his mission, so he repeatedly brings Bart back to life just to kill him."
580,,580,/episode/580.webp,Friend with Benefit,27,"Lisa makes a new pal at school named Harper, whose internet billionaire father becomes buddies with a different Simpson: Homer. Soon, though, Lisa becomes worried that Harper is a little too entitled."
581,2015-11-22,581,/episode/581.webp,"Lisa with an ""S""",27,"When Homer loses $5,000 at a poker game with Broadway legend Laney Fontaine, the only way he is able to settle the bet is if he loans Lisa to Laney for a month. Laney turns Lisa into a showbiz kid, and Marge and Homer fear they made a mistake letting her go."
582,,582,/episode/582.webp,Paths of Glory,27,"Lisa sets out to restore the tarnished reputation of Springfield’s first female inventor. To locate her invention, she scours an abandoned asylum and a restaurant that caters to men. Bart joins Lisa at the asylum, stealing one of the homicidal patient’s notebooks, and bragging to the boys at school that he wrote the entries himself. This revelation causes Homer and Marge to believe he is a sociopath, which Bart decides to use to his advantage until matters go too far."
583,2015-12-13,583,/episode/583.webp,Barthood,27,"Bart’s coming of age story, a la “Boyhood”, chronicles his life from six years old to his time as an accomplished young man. Along the way, his tense relationship with Homer, an overly uncaring version of himself, and Lisa, who overshadows him in every way possible shape Bart more than he realizes."
584,,584,/episode/584.webp,The Girl Code,27,"After a photo Marge posts on social media gets Homer fired, he returns to the best job he ever had, a dishwasher at a Greek restaurant. This same post inspires Lisa to code an app that predicts the real-life consequences of anything you post online, only to create sentient artificial intelligence."
585,,585,/episode/585.webp,Teenage Mutant Milk-caused Hurdles,27,"A new teacher named Carol Berrera (guest voice Sofia Vergara) arrives at Springfield Elementary, and a smitten Bart attempts to win her over."
586,,586,/episode/586.webp,Much Apu About Something,27,"Sanjay passes his stake in the Kwik-E-Mart to his millennial son, Jay, who turns it into a hip, health food market against Apu’s insistence on tradition. Bart, whom Homer had convinced to give up pranking, is called upon to return to his trickster life and take down the new store. "
587,2016-02-14,587,/episode/587.webp,Love Is in the N2-O2-Ar-CO2-Ne-He-CH4,27,"Lonesome Professor Frink uses science to turn himself into a man whom women find attractive. Then, overwhelmed by the attention, he invents an algorithm to perfectly pair the lonely men and women of Springfield, realizing that scientific exploration is his true love. Meanwhile, Marge, Bart, and Lisa visit Grampa for Valentine’s Day and try to rescue the occupants from a drug-induced hallucination that allows them to relive their happiest memories."
588,2016-02-21,588,/episode/588.webp,Gal of Constant Sorrow,27,"After Bart accidentally sends a sweet homeless woman's cart into the river, he allows the vagabond to live in his closet for a small fee. When Lisa discovers that the woman is an incredible folk singer, she offers her own closet and plans a concert, only to be disappointed by Hettie's surprising substance abuse and violent nature. Meanwhile, Homer tries to prove that he is handy, but accidentally traps the cat in the walls of the house."
589,2016-03-06,589,/episode/589.webp,Lisa the Veterinarian,27,"After performing CPR on a tased raccoon, Lisa discovers her calling to be veterinarian and becomes an intern at the local office, but learns a tough lesson when her neglected class hamster dies. Meanwhile, Marge moonlights as a crime scene cleaner for a little extra money, and the trauma of the gory scenes make her increasingly dead inside."
590,2016-03-13,590,/episode/590.webp,The Marge-ian Chronicles,27,"Lisa volunteers for a future permanent migration to Mars, much to Marge's chagrin. As she searches for a way to convince Lisa not to go, Marge hits upon the most devious strategy of all, and volunteers to go along for the ride. Will the Simpson girls be mankind's first residents of the Red Planet?"
591,2016-04-03,591,/episode/591.webp,The Burns Cage,27,"When Smithers is devastated by Burns’ lack of affection towards him, Homer becomes tenacious to find Smithers a partner. Meanwhile, after he orchestrates the removal of the lead role in the school’s stage production of “Casablanca,” Milhouse serves as a terrible understudy, which frustrates his co-star, Lisa."
592,2016-04-10,592,/episode/592.webp,How Lisa Got Her Marge Back,27,"Marge takes Lisa on a girls’s weekend touristy trip to Capital City, where they attend a performance of Bad News Bears: The Musical starring  Andrew Rannells. During a backstage meet-and-greet after the show,  Andrew Rannells reminds Lisa — who is going through a rough spell with Marge — that she should feel lucky to have such a great mom. Meanwhile, Bart becomes frustrated that everyone expects his pranks, so he bonds with Maggie to trick people."
593,2016-04-24,593,/episode/593.webp,Fland Canyon,27,"Homer recalls a tense family vacation to the Grand Canyon with the Flanders family. At first, the Flanders' perfection puts the families at odds, but when they get stranded and Ned and Homer go for help, the families finally bond with each other."
594,2016-05-08,594,/episode/594.webp,To Courier with Love,27,"The episode starts with a flashback to the Stone age (50,000 years ago), ""The Invention of Motherhood"" with a prehistoric Homer, Bart, Lisa and Maggie lookalikes doing their shenanigans while a Marge lookalike tries to keep everything in order. The episode fast forwards to the present day, with the family still doing their usual shenanigans while Marge tries to maintain order. She manages to convince Homer to clean the garage, and in the process he finds a rare Morgan Motors vehicle that was probably left behind by the previous owner, and chooses to keep the car for himself."
595,2016-05-15,595,/episode/595.webp,Simprovised,27,"After butchering a speech in front of all his friends at work, Homer turns to improvisation comedy to regain his confidence in his public speaking talents. Meanwhile, Marge offers to rebuild Bart’s lackluster treehouse, but tensions escalate when Bart questions her building skills."
596,2016-05-22,596,/episode/596.webp,Orange is the New Yellow,27,"When Marge gets arrested for letting Bart go to the park unsupervised, she serves time only to realize that prison is a welcome break from the demands of her life as a mother and wife. In her absence, Homer struggles to manage all of the parenting and household responsibilities that Marge predominantly handles."
597,2016-09-25,597,/episode/597.webp,Monty Burns' Fleeing Circus,28,"When Springfield is burned to the ground, the Simpsons beg Mr. Burns to fund its rebuilding. Burns agrees - with one condition: he gets to put on a variety show at the Springfield Bowl."
598,2016-10-02,598,/episode/598.webp,Friends and Family,28,"Mr. Burns hires the Simpsons to play his live-in virtual reality family, but excludes Homer so that he may play dad. Now lonesome, Homer finds a new best friend in girl-next-door Julia, who eats, drinks and thinks just like him."
599,2016-10-09,599,/episode/599.webp,The Town,28,"After Homer catches Bart rooting for Springfield's football rival, the Boston Americans, he plans a family ""hate-cation"" trip to Boston in an attempt to show Bart that Boston is a terrible city."
600,,600,/episode/600.webp,Treehouse of Horror XXVII,28,This year's shocking stories are:
601,2016-10-23,601,/episode/601.webp,Trust But Clarify,28,"Lisa and Bart investigate Krusty's suspicious new ""Krustaceans"" candy. Meanwhile, Homer wants a promotion at the nuclear plant and asks Marge to help him dress for the part, and news anchorman Kent Brockman struggles to find his position in the changing media world."
602,2016-11-06,602,/episode/602.webp,There Will Be Buds,28,"Homer gets roped into coaching the kids' lacrosse team with Milhouse's father, Kirk, who is in desperate need of a friend. When Kirk gets too clingy, Homer vents about how much of a loser he is. Kirk overhears this rant and disappears, right when the team needs him most: for the championship game."
603,2016-11-13,603,/episode/603.webp,Havana Wild Weekend,28,"When the Retirement Castle and the V.A. Hospital can't solve Grampa's health issues, the Simpsons decide to take a family trip to Cuba to get him cheap medical care."
604,2016-11-20,604,/episode/604.webp,Dad Behavior,28,"Homer finds a new app that makes his life much easier and outsources his father-son bonding. Meanwhile, Grampa finds out he is about to become a father again."
605,2016-12-04,605,/episode/605.webp,The Last Traction Hero,28,"An accident places Homer in a cast, and in a position to sue Mr. Burns. This leaves Marge unfulfilled, so she turns to an unexpected source for romance. Meanwhile, Lisa is proclaimed ""Bus Monitor"" and tries to keep the peace."
606,2016-12-11,606,/episode/606.webp,The Nightmare After Krustmas,28,"Krusty tries to impress his daughter as they spend Christmas with The Simpsons. Meanwhile, Reverend Lovejoy seeks converts after church attendance plummets, and Maggie is haunted by a spooky Christmas toy."
607,2017-01-08,607,/episode/607.webp,Pork and Burns,28,"When Marge becomes obsessed with a Japanese style of living, the Simpsons must part with any item that no longer brings them joy. For Homer, this means finding a new home for the family pig. For Lisa, it means saying goodbye to her beloved saxophone."
608,2017-01-15,608,/episode/608.webp,The Great Phatsby (1),28,"Mr. Burns tries to relive his glory days and crosses paths with a mysterious music mogul. After getting conned by him and reduced to bankruptcy, Burns seeks revenge on the music producer with the help of Homer, Bart, rapper Jazzy James, and the mogul's ex-wife, Praline. Also, Lisa is courted by the richest child in town, Waylon Smithers, Jr. begins a perilous journey, and Marge opens an obscure boutique store."
609,2017-01-15,609,/episode/609.webp,The Great Phatsby (2),28,"Mr. Burns tries to relive his glory days and crosses paths with a mysterious music mogul. After getting conned by him and reduced to bankruptcy, Burns seeks revenge on the music producer with the help of Homer, Bart, rapper Jazzy James, and the mogul's ex-wife, Praline. Also, Lisa is courted by the richest child in town, Waylon Smithers, Jr. begins a perilous journey, and Marge opens an obscure boutique store."
610,2017-02-12,610,/episode/610.webp,Fatzcarraldo,28,"When all of the fast food restaurants in Springfield become healthy, Homer turns to the last bastion of greasy food for comfort - and digs up some childhood memories along the way. Meanwhile, Lisa must find a good news story when the future of her school radio station is put in jeopardy."
611,2017-02-19,611,/episode/611.webp,The Cad and the Hat,28,"When Bart betrays Lisa, he has to deal with his guilt – literally. Meanwhile, Springfield is surprised when Homer is revealed to be a chess savant."
612,2017-03-05,612,/episode/612.webp,Kamp Krustier,28,"When Bart and Lisa return home abruptly after a traumatic incident at Kamp Krusty, they put an end to Homer and Marge's romantic encounters. Without sex to distract him, Homer becomes a more productive worker and caring husband, but Marge misses the old Homer. Meanwhile, Bart and Lisa return to camp to confront the source of their trauma."
613,2017-03-12,613,/episode/613.webp,22 For 30,28,"Bart goes from delinquent with detention to the star basketball player at Springfield Elementary. Lisa covers Bart's success for the school paper, and Homer becomes the team's coach. But matters go awry when Bart gets involved with the mafia."
614,2017-03-19,614,/episode/614.webp,A Father's Watch,28,"Worried that Bart is destined for failure, Marge turns to a series of parenting ""experts"" for advice. Homer chooses to cash in on an expert's advice by opening up a trophy store in Springfield. Meanwhile, Bart gets some needed encouragement from Grampa, who gives him a precious watch coveted by Homer."
615,2017-04-02,615,/episode/615.webp,The Caper Chase,28,"Mr. Burns opens his own university (a la Donald Trump) after visiting his alma mater, Yale, and discovering how politically correct it's become."
616,,616,/episode/616.webp,Looking for Mr. Goodbart,28,"Bart gets in trouble on Grandparents Day at school and is forced to hang out with Skinner's mother as punishment. After spending time with various grandmas in the neighborhood, he learns the benefits of hanging out with the elderly, but eventually recognizes the dangers of taking advantage of them. Meanwhile, Peekimon Get, a parody of Pokémon Go, has taken over the town of Springfield."
617,2017-05-07,617,/episode/617.webp,Moho House,28,"Homer and Marge attempt to work on their marriage, not realizing that Mr. Burns and Nigel have a bet on whether Nigel can bisect them apart. With the successful, albeit unconventional, help of Moe, the couple gets back their mojo."
618,2017-05-21,618,/episode/618.webp,Dogtown,28,"When Homer's court case determines that a dog's life is more profitable than the one of a human, the status of man's best friend rises in Springfield. When the dogs recognize their new position of power, they assert their dominance over the humans."
619,,619,/episode/619.webp,The Serfsons,29,"In a magical medieval world, Marge's mother is turned into an Ice Walker, and the only way for Homer to seek the cure is to make Lisa perform illegal magic. When the King discovers this attempt, he kidnaps Lisa, and Homer must lead a feudal uprising to rescue her."
620,2017-10-08,620,/episode/620.webp,Springfield Splendor,29,"Marge and Lisa turn Lisa's sad experience into a successful graphic novel-turned-Broadway show, but they struggle with creative differences and egos."
621,2017-10-15,621,/episode/621.webp,Whistler's Father,29,"Homer discovers that Maggie is a whistling savant and launches her baby-celebrity career. Meanwhile, Marge impresses Fat Tony with her interior design taste, and he hires her to style his brothel."
622,2017-10-22,622,/episode/622.webp,Treehouse of Horror XXVIII,29,The Sweets Hereafter: The Simpsons are Halloween candies living in fear of being eaten.
623,2017-11-05,623,/episode/623.webp,Grampy Can Ya Hear Me,29,Grampa gets a hearing aid and finally hears what everyone has been saying about him.
624,,624,/episode/624.webp,The Old Blue Mayor She Ain't What She Used to Be,29,"Frustrated with the local government, Marge plans to run for Mayor. To win public support, she begins making Homer the butt of her jokes."
625,,625,/episode/625.webp,Singin' in the Lane,29,"Homer and the guys reunite their old bowling team to cheer up Moe, only to end up in fierce competition with a team of arrogant millionaires. Meanwhile, Lisa and Marge try to teach Bart that money isn't everything."
626,2017-12-03,626,/episode/626.webp,Mr. Lisa's Opus,29,"Lisa's version of ""Barthood"". First, Homer discovers how smart she is, then she will go to college, and finally being scared after getting out of Springfield. Meanwhile, Ned will try to cure Homer of his alcohol problem."
627,2017-12-10,627,/episode/627.webp,Gone Boy,29,"Winter is ruined for Springfield when Bart falls into an underground missile silo, leading the town to put together a search party to find him. After most give up hope, Sideshow Bob manipulates Milhouse into revealing where Bart is hiding."
628,2018-01-07,628,/episode/628.webp,Haw-Haw Land,29,"When the Simpsons go to a STEM conference, Lisa falls for a crooning jazz pianist named Brendan Beiderbecke. After seeing the pair together, Nelson becomes jealous because of his past relationship with Lisa and tries to win her over instead, making Milhouse get caught in the same love triangle over Lisa. Meanwhile, Homer and Marge become suspicious when Bart discovers that he has an affinity for chemistry, leaving everyone to wonder just what he is up to."
629,2018-01-14,629,/episode/629.webp,Frink Gets Testy,29,"Mr. Burns builds a doomsday ark after believing that the end of the world is near when he watches an old Orson Welles show about Nostradamus. Professor Frink comes up with a new way of testing the citizens of Springfield after Burns wants a test to determine who should go on a spacecraft with him. The results shake the Simpson family to their core, as Homer is dismayed to find he has the lowest possible score, while Lisa becomes obsessed with finding out how Ralph scored higher than she did."
630,2018-03-18,630,/episode/630.webp,Homer Is Where the Art Isn't,29,"When Homer is accused of stealing a million-dollar painting, only a detective from the 1970s can clear his name, or send him to jail."
631,2018-03-25,631,/episode/631.webp,3 Scenes Plus a Tag from a Marriage,29,"While visiting their old apartment in Capital City, Homer and Marge recount the story of their transition from loving their lifetime without kids to being miserable parents."
632,2018-04-01,632,/episode/632.webp,Fears of a Clown,29,"In a re-imagining of Stephen King's novel It, the entire faculty at Springfield Elementary School pranks Bart, forcing him to seek revenge by making them wear clown masks, only to cause the entire town to start fearing clowns, destroying Krusty's career. While a tortured Krusty tries his hand at serious drama with a regional theater company, Marge convinces a judge to send Bart to a rehabilitation camp in order to try to cure him of pulling pranks."
