id,airdate,episode_number,image_path,name,season,synopsis
134,1995-10-29,134,/episode/134.webp,Treehouse of Horror VI,7,Intro: Krusty the Clown is the Headless Horseman who throws his decapitated head at the screen; a couch gag where The Simpsons are hanging around...by their necks on nooses.
135,1995-11-05,135,/episode/135.webp,King-Size Homer,7,"To get out of the daily grind (and Mr. Burns' new exercise program for his employees), Homer looks for a way to get on disability so he can work from home. When injuring himself on the job doesn't work, he turns to one of his greatest loves (eating) to become morbidly obese."
136,1995-11-19,136,/episode/136.webp,Mother Simpson,7,"After faking his own death and getting the mistake cleared up at the town courthouse, Homer makes a discovery: his mother, Mona is still alive. However, the joyous reunion at the cemetery is cut short when the FBI comes after Mona for something she did in the 1960s, which is connected to Mr. Burns and is why she abandoned Abe and Homer."
137,1995-11-26,137,/episode/137.webp,Sideshow Bob's Last Gleaming,7,"Tired of mind-numbing television in prison, Sideshow Bob manages to steal a nuclear bomb and threatens to destroy Springfield if TV is not completely banned from town."
138,1995-12-03,138,/episode/138.webp,The Simpsons 138th Episode Spectacular,7,"In this spoof of anniversary shows and sitcom retrospective clip show episodes, Troy McClure, whom you may remember from such Fox Network specials as Alien Nose Job and Five Fabulous Weeks of The Chevy Chase Show, hosts a behind-the-scenes look at The Simpsons, which includes clips from their humble beginnings as filler on The Tracy Ullman Show, answers to popular fan questions, and never-before-seen deleted scenes, including the alternate ending to the ""Who Shot Mr. Burns?"" two-parter."
139,1995-12-17,139,/episode/139.webp,Marge Be Not Proud,7,"Bart gets busted for shoplifting the season's must-have video game, and Marge decides to ban him from everything the family is doing for Christmas as a brutal punishment for his misdemeanor. Which gives Bart the realization that he's not the little boy she loves anymore."
140,1996-01-07,140,/episode/140.webp,Team Homer,7,"In order to play on League Night at Barney's Bowl-A-Rama, Homer assembles a ragtag group of bowlers (Apu, Moe, and Otto the bus driver) to play, but when he can't pony up the $500 fee, he asks Mr. Burns for the money, who is so high on ether that he thinks Homer is The Pillsbury Doughboy (Poppin' Fresh). Meanwhile, Bart buys the latest issue of MAD magazine and finds an iron-on T-shirt decal that reads ""Down with Homework"", which he wears to school — and the ensuing riot leads Springfield Elementary to implement a uniforms-only dress code that slowly turns the kids into boring shells of their former selves."
141,1996-01-14,141,/episode/141.webp,Two Bad Neighbors,7,"During a neighborhood rummage sale, Homer sees a moving van at a vacant house across the street from his home and learns that the new neighbors are former President George H.W. Bush and ex-First Lady Barbara Bush, whom everyone (except Bart and Homer) welcomes with open arms."
142,1996-02-04,142,/episode/142.webp,Scenes from the Class Struggle in Springfield,7,"While the Simpsons visit Ogdenville's Outlet Mall to buy a new TV (that looks just like the old one), Marge finds a fancy Chanel suit and begins wearing it around the house and around town so she can feel like a rich housewife — and an old friend from high school sets out to make Marge's wish of being high-class come true by inviting her to a country club. Meanwhile, Mr. Burns challenges Homer to a golf game at the same country club for modeling children and perfect dancers for young girls, Marge is trying to get into, and Homer discovers how Mr. Burns wins at golf despite being a decrepit, old man."
143,1996-02-11,143,/episode/143.webp,Bart the Fink,7,"While doling out checks to everyone he knows after opening a bank account with money he got from an inheritance, Bart accidentally reveals that Krusty the Klown has been hiding his earnings in an illegal offshore account in the Cayman Islands, resulting in his hero's financial ruin (after the IRS seize his assets) and suicide by airplane crash."
144,1996-02-18,144,/episode/144.webp,Lisa the Iconoclast,7,"On the days before Springfield's Founders' Day, Lisa discovers that Jebediah Springfield was actually a pirate who tried to murder George Washington and changed his name to dodge authorities, but no one (not even her own mother) wants to hear the truth — except for Homer, who risks his role as town crier for the Founders' Day parade to help his daughter."
145,1996-02-25,145,/episode/145.webp,Homer the Smithers,7,"Smithers goes on vacation after having a mental breakdown over not being able to save Burns from being harassed by a drunken Lenny. Homer takes Smithers' place as Mr. Burns' assistant, but all the abuse Homer takes from Mr. Burns causes him to snap and punch the old man in the face, which drives Mr. Burns to be more self-reliant."
146,1996-03-17,146,/episode/146.webp,The Day the Violence Died,7,"Bart meets a homeless man named Chester J. Lampwick, who claims to have created ""Itchy"", one half of the popular Itchy and Scratchy cartoon duo, but was left penniless when the idea was stolen by Roger Meyers, Sr. With Bart's help, he successfully sues the studio and wins, but at the cost of I&S Studios shutting down due to bankruptcy."
147,1996-03-24,147,/episode/147.webp,A Fish Called Selma,7,"When Troy McClure is sentenced to renew his driver's license after getting pulled over for erratic driving, he meets Selma (who is still looking for a man so she can have a family and not die alone) and decides to marry her to revive his moribund movie career, which fizzled out due to bad project choices, his alcoholism, and the possibly very true rumor that Troy is sexually attracted to fish and once committed an unspeakable act at the Springfield Aquarium. Selma is okay with being Troy's sham wife, but things get complicated when Troy's agent wants Troy to have sex with Selma so she can have a baby."
148,1996-03-31,148,/episode/148.webp,Bart on the Road,7,"While stuck with Patty and Selma at the DMV as part of ""Go to Work With Your Parents Day"" (which Principal Skinner cooked up in order to accommodate his vacation to Hong Kong) Bart creates a fake driver's license that says he's 25 years old, and, with the help of Martin's $600 he got from his father the stockbroker, Bart, Martin, Milhouse, and Nelson go on a road trip. Meanwhile, Lisa and Homer spend time together at the nuclear plant, and Marge must deal with being left alone."
149,1996-04-14,149,/episode/149.webp,22 Short Films About Springfield,7,"While spitting off the overpass, Bart wonders if anyone in Springfield has crazy adventures, leading to a Pulp Fiction-style interconnected story showing the antics of other Springfieldianites."
150,1996-04-28,150,/episode/150.webp,"Raging Abe Simpson and His Grumbling Grandson in ""The Curse of the Flying Hellfish""",7,Abe Simpson and Mr. Burns fight over who gets to be the rightful owner of a collection of paintings looted during World War II. Bart comes along for the ride after learning that this isn't one of Grampa's crazy stories brought on by senility and being desperate for attention.
151,1996-05-05,151,/episode/151.webp,Much Apu About Nothing,7,"Anti-illegal immigrant fever sweeps town after taxes get raised over bear extermination, and Apu faces deportation unless Homer and company can help him pass his citizenship exam."
152,1996-05-19,152,/episode/152.webp,Homerpalooza,7,"Feeling uncool, Homer decides to take Bart and Lisa to the Hullabalooza music festival. But, while feeling more out of place, Homer accidentally takes a cannonball to the stomach. This newfound skill makes him the sleeper hit of the festival, and a hero to Bart — but at what cost to his health?"
153,1996-05-19,153,/episode/153.webp,Summer of 4 Ft. 2,7,"After realizing that none of the kids considered her friends in school care enough to sign her yearbook, Lisa decides to use the Simpsons' family vacation to Ned Flanders' beach house as an opportunity to ditch her nerdy persona, and be a cool kid."
154,1996-10-27,154,/episode/154.webp,Treehouse of Horror VII,8,This year's hilarious horror stories include:
155,1996-11-03,155,/episode/155.webp,You Only Move Twice,8,"The Simpsons are moving to a town called Cypress Creek after Homer is offered a position at a nuclear plant run by a benevolent man who's actually an evil genius bent on world domination. While Homer is blissfully unaware of his boss's actions and happily adjusting to his new job, Marge tries to compete with a house that cleans itself, Lisa becomes allergic to the wildlife, and Bart is put in a class for special ed. kids after his teacher discovers that Bart doesn't know how to read cursive or do long division."
156,1996-11-10,156,/episode/156.webp,The Homer They Fall,8,"After Bart gets mugged for his Star Trek belt by Dolph, Jimbo, and Kearney, Homer confronts their fathers and gets beat up as well — but ends up scaring them when he takes all of their punches and doesn't react, prompting Moe the bartender to train Homer to be a boxer."
157,1996-11-17,157,/episode/157.webp,"Burns, Baby Burns",8,"Mr. Burns is reunited with his illegitimate, boorish, middle-aged son, Larry, and when Mr. Burns disowns him, Homer comes up with a harebrained kidnapping plan to get Mr. Burns to take Larry back."
158,1996-11-24,158,/episode/158.webp,Bart After Dark,8,"While Lisa and Marge spend the day cleaning rocks after Captain MacCallister runs his ship aground, Bart gets in trouble for breaking the gargoyle of an old house, and the owner wants Bart to work for her to pay for it — by making him her right-hand man for her burlesque house."
159,1996-12-01,159,/episode/159.webp,A Milhouse Divided,8,"After realizing how lazy and slovenly her family has become by dining each night in front of the TV (including Homer complaining about the dishes not being transparent and Bart being in his underwear), Marge decides to throw a dinner party, but it goes pear-shape when Milhouse's parents (Kirk and Luann) get into heated arguments about their lives and Luann announces that she wants a divorce. While Luann sees the split as a chance to reinvent herself and Milhouse doesn't really care one way or the other (though he did think Nelson would bully him over it), Homer worries the same will happen between him and Marge after seeing Kirk's life spiral without his wife."
160,1996-12-15,160,/episode/160.webp,Lisa's Date with Density,8,"After stealing Superintendent Chalmers' car emblem off his new Honda Accord, Nelson is sentenced to janitorial work. While Lisa is serving detention for snickering at Nelson spraying Groundskeeper Willie with a hose, she becomes fascinated with and develops a crush on the bully. Meanwhile, Homer takes an auto dialer that was recently used in a telemarketing scam and creates a telemarketing scam of his own."
161,1996-12-29,161,/episode/161.webp,Hurricane Neddy,8,"A hurricane blows through Springfield and spares the Simpsons, but unfortunately, the Flanders' house is the only one that takes damage, leaving the Flanders family homeless and reeling. Things get worse when everyone in town comes together to rebuild Ned's house (rather poorly) and Ned goes on the mother of all tirades, calling everyone including Homer out for their personality flaws, then commits himself to a mental hospital, where Ned's childhood therapist reveals why he lashed out."
162,1997-01-05,162,/episode/162.webp,El Viaje Misterioso de Nuestro Jomer (The Mysterious Voyage of Homer),8,"Marge reluctantly takes Homer to the town's chili cook-off, on the grounds that Homer doesn't drink and make a fool of himself like he did the previous year. This year, however, Chief Wiggum has a secret ingredient to defeat Homer's discerning taste buds during the chili contest: Guatemalan insanity peppers, which cause Homer to lose his mind... and end up on a spirit quest to find his soulmate."
163,1997-01-12,163,/episode/163.webp,The Springfield Files,8,"In this tale narrated by Leonard Nimoy (last seen on season four's ""Marge vs. The Monorail""), Homer sees an alien in the woods, and while everyone else writes it off as a drunken hallucination (since Homer tested ""Boris Yeltsin"" drunk on Moe's Breathalyzer), Agents Mulder and Scully from The X-Files come to Springfield to help Homer solve the case."
164,1997-01-19,164,/episode/164.webp,The Twisted World of Marge Simpson,8,"Marge falls out with the Springfield Investorettes over their risky practices, and she invests in a fledging pretzel franchise out of spite. However, she struggles to stay in business, and Homer resorts to desperate measures to help her."
165,1997-02-02,165,/episode/165.webp,Mountain of Madness,8,"After an extremely disappointing display of teamwork during a fire drill, Mr. Burns forces his workers to participate in a cabin race at a mountain retreat, where the last one to find the cabin will be fired."
166,1997-02-07,166,/episode/166.webp,Simpsoncalifragilisticexpiala(Annoyed Grunt)cious,8,"A British nanny known as ""Shari Bobbins"" is hired to shape up the Simpson family after Marge begins losing her hair to stress, only to learn that the lessons she teaches won't stick if she leaves — or stays."
167,1997-02-09,167,/episode/167.webp,The Itchy & Scratchy & Poochie Show,8,"Following a slight fall in the ratings and Lisa telling Roger Meyers, Jr. that The Itchy & Scratchy Show might be getting a little stale, the staff at I&S Studios create a new character, Poochie the dog, and hire Homer to voice him. But when Poochie's premiere episode focuses on him to the exclusion of Itchy and Scratchy's normal violent antics and comes off as annoying and pandering, fans of the show get in an uproar and Homer feels that he's the only one who sees potential in the new character."
168,1997-02-16,168,/episode/168.webp,Homer's Phobia,8,"Homer makes friends with John, a kitschy antiques store dealer and lover of all things camp. However, when Marge tells Homer that John is a homosexual, Homer freaks out and, fearing that his son will emulate John, takes Bart on a misguided journey to make his son heterosexual."
169,1997-02-23,169,/episode/169.webp,Brother from Another Series,8,"Sideshow Bob is released from prison again for good behavior and put into the custody of his brother, Cecil, but Bart and Lisa still think Bob is out to kill them — until they learn that Cecil is just as evil as Bob."
170,1997-03-02,170,/episode/170.webp,"My Sister, My Sitter",8,"Lisa decides to become a babysitter — and finds that her biggest challenge is her own brother, who she has to look after as Homer and Marge check out the new outdoor mall."
171,1997-03-16,171,/episode/171.webp,Homer vs. the Eighteenth Amendment,8,"After Bart gets drunk at the annual St. Patrick's Day parade, Springfield enforces a Prohibition-era law banning all alcohol from being made and sold. As a result, Moe opens a speakeasy, Homer becomes a bootlegger, and a no-nonsense Elliot Ness-style lawman sets out to stop them."
172,1997-04-06,172,/episode/172.webp,Grade School Confidential,8,"When Martin Prince's birthday party bombs due to food poisoning, Principal Skinner and Mrs. Krabappel hide out in the kiddie playhouse and fall for each other. However, Bart sees them making out and promises to keep quiet in exchange for having his permanent record switched with Milhouse's, but how long can the lovebirds keep Bart from singing to others about their affair?"
173,1997-04-13,173,/episode/173.webp,The Canine Mutiny,8,"Bart commits credit card fraud again — this time, by filling out a credit card application under Santa's Little Helper's name and going on a catalogue shopping spree — which leads him to buy a wonder dog named Laddie and send Santa's Little Helper to the Repo Depot when everything he bought on the card gets taken back due to lack of payment."
174,1997-04-20,174,/episode/174.webp,The Old Man and the Lisa,8,"While Lisa champions a recycling program, Mr. Burns discovers that he's lost his fortune (and was never told this before because his accountants are sycophants/afraid of Mr. Burns' wrath) and now must live like a common man. With Lisa's help, Mr. Burns devises a plan to regain his fortune."
175,1997-04-27,175,/episode/175.webp,In Marge We Trust,8,"Marge volunteers at the church and becomes ""The Listen Lady"" who actually helps people with their problems, which doesn't sit well with Reverend Lovejoy. Meanwhile Homer, Lisa, and Bart solve the mystery of why Homer's face is on a dishwashing detergent box from Japan."
176,1997-05-04,176,/episode/176.webp,Homer's Enemy,8,"A new employee comes to hate Homer Simpson for being a lovable idiot who has everything good going for him and sets out to prove that Homer doesn't deserve his lot in life. Meanwhile, Bart buys an abandoned factory at auction and uses it as his own personal playground."
177,1997-05-11,177,/episode/177.webp,The Simpsons Spin-Off Showcase,8,"In this special episode, Troy McClure presents three possible spin-off shows featuring the main and ancillary characters from The Simpsons: In ""Chief Wiggum: P.I.(G)"", Chief Wiggum and Principal Skinner are private detectives in New Orleans, Louisiana, who go after a kingpin named Big Daddy who has kidnapped Wiggum's son, Ralph, ""The Love-Matic Grampa"" sees Moe Szyslak taking dating advice from his Love Tester machine, which is now possessed by Abraham ""Grampa"" Simpson, and The Simpson family (save Lisa) and some secondary characters get their own cheesy late 1960s sketch show called, ""The Simpson Family Smile-Time Variety Hour""."
178,1997-05-18,178,/episode/178.webp,The Secret War of Lisa Simpson,8,Bart is shipped off to military school after a particularly destructive prank (lining up 15 police bullhorns and unleashing a soundwave that shatters all the glass in town) — and Lisa tags along (despite that the military school is boys-only and the other cadets don't take kindly to change) after finding public school education has become a grind.
179,1997-09-21,179,/episode/179.webp,The City of New York vs. Homer Simpson,9,"The Simpsons are going to New York City, after a sober and insane Barney Gumble drives Homer's car to Manhattan and leaves it at the World Trade Center Twin Towers. While Homer has to wait by his car in order to get the boot off, Marge and the kids see the sights."
180,1997-09-28,180,/episode/180.webp,The Principal and the Pauper,9,Principal Skinner's 20th anniversary as school principal is interrupted by a Vietnam vet who reveals that his name is Seymour Skinner and that the man posing as him is a reformed street punk named Armin Tamzarian.
181,1997-10-19,181,/episode/181.webp,Lisa's Sax,9,"After Lisa's saxophone gets crushed in the street, Homer tells the story of how Lisa first discovered her musical talent — which coincides with the tragic tale of how Bart's first day of kindergarten turned him into the troublemaker he is today."
182,1997-10-26,182,/episode/182.webp,Treehouse of Horror VIII,9,
183,1997-11-02,183,/episode/183.webp,The Cartridge Family,9,
184,1997-11-09,184,/episode/184.webp,Bart Star,9,"Peewee football comes to Springfield as a means to fight childhood obesity, and when Homer becomes the coach (after Flanders angrily gives him the position to keep Homer from heckling him), he promotes Bart to star player status despite the boy's lack of talent."
185,1997-11-16,185,/episode/185.webp,The Two Mrs. Nahasapeemapetilons,9,"Apu's days as a swinging bachelor are numbered when he receives a lotus flower in the mail, a symbol that the arranged marriage his mom planned for him when he was a child (as seen on ""Much Apu About Nothing"") is nearing. To get out of it, Apu decides to lie to his mom that he's already married...to Marge Simpson."
186,1997-11-23,186,/episode/186.webp,Lisa the Skeptic,9,"When construction for a new mall threatens an area where a bunch of fossils were found, Lisa manages to convince Principal Skinner to schedule a school archaeological dig to find missing fossils. The field trip seems to have been futile, until Lisa finds a statue of a skeleton man with wings, which everyone in town believes is an angel and brings an apocalyptic message."
187,1997-12-07,187,/episode/187.webp,Realty Bites,9,"Feeling bored with life (once again), Marge takes a job in real estate but is uncomfortable having to bend the truth to make sales, especially when she wants to sell the Flanders a house with a violent history. Meanwhile, Homer buys Snake's car at a police auction and Snake breaks out of jail to get it back."
188,1997-12-21,188,/episode/188.webp,Miracle on Evergreen Terrace,9,"Bart accidentally destroys the family's Christmas presents and blames the disaster on a burglar, resulting in the rest of the town opening its hearts and wallets for them, but when Santa's Little Helper finds the melted wreckage and Bart confesses that he lied, the town shuns and harasses the family."
189,1998-01-04,189,/episode/189.webp,"All Singing, All Dancing",9,"In yet another clip show episode, Homer is appalled that the movie he rented, Paint Your Wagon, is a campy, Western-themed musical and not a gritty, spaghetti Western. Marge and the family try to prove that musicals are part of their life (and the lives of the people of Springfield) through a collection of videos (read: past clips) showing The Simpsons' most memorable songs and musical moments, only to be interrupted by Snake Jailbird, who holds the family hostage."
190,1998-01-11,190,/episode/190.webp,Bart Carny,9,"Bart and Homer are forced to work as carnies after Bart crashes the Mercedes convertible said to belong to Adolf Hitler, and befriend a father-son carny duo named Spud and Cooder, but when Homer brings Spud and Cooder to their home, it's the Simpsons that end up getting kicked out."
191,1998-02-08,191,/episode/191.webp,The Joy of Sect,9,"Homer and the rest of the town (save Marge, Reverend Lovejoy, the Flanders family, Mr. Burns, Smithers, Lenny, Cletus, Groundskeeper Willie, and the nameless crowd that showed up for Mr. Burns' cult event) are brainwashed into joining a cult known as the Movementarians. Meanwhile, Mr. Burns tries to start his own cult...with disastrous results."
192,1998-02-15,192,/episode/192.webp,Das Bus,9,"Springfield Elementary's Model U.N. participants (including Bart and Lisa) wind up stranded on an island when their bus goes off a bridge. Meanwhile, Homer tries to start an Internet company — even though he has no business plan, no computer, and no knowledge of the Internet."
193,1998-02-22,193,/episode/193.webp,The Last Temptation of Krust,9,"At a charity comedy show, Krusty discovers that his brand of humor is out of step with modern stand-up comedy. After announcing his retirement and going on a drunken bender, Krusty wakes up at the Simpsons household and, with the help of Bart Simpson and special guest star, Jay Leno, Krusty becomes an anti-establishment stand-up comic (a la George Carlin, Denis Leary, Dennis Miller, and Bill Hicks), but must choose between his ethics and selling out when an agent offers him the chance to be the spokesman for a new SUV."
194,1998-03-01,194,/episode/194.webp,Dumbbell Indemnity,9,"Moe falls for a flower vendor named Renee, and commits insurance fraud (with help from Homer) so he can keep the money and the romance coming. But when Homer gets arrested, Moe let’s him take the fall."
195,1998-03-08,195,/episode/195.webp,Lisa the Simpson,9,"After failing to immediately figure out a picture puzzle, forgetting her locker combination, and turning in a piss-poor school project, Lisa fears she's losing her brainpower, and things get worse when Grampa Simpson tells Lisa that she may have the Simpson Gene, which has already made Homer, Bart, and Grampa himself dumber with age. Meanwhile, Jasper Beardley uses the Kwik-E-Mart freezers to cryogenically preserve himself, and Apu deals with the situation the only way he knows how: by making a profit off it."
196,1998-03-22,196,/episode/196.webp,This Little Wiggy,9,"While on a day trip to a hands-on science museum, Marge feels sorry for Ralph Wiggum being bullied and suggests to Chief Wiggum that Ralph and Bart be play buddies, which Bart objects to — until he realizes that Ralph is the son of an incompetent police chief and has police equipment at his disposal (including a master key that opens up every lock in town, including one to an abandoned prison's electric chair)."
197,1998-03-29,197,/episode/197.webp,Simpson Tide,9,"Homer joins the Naval Reserve after getting fired again, with world-threatening results when he shoots his commanding officer out of the submarine and steers the sub into Russian waters. Meanwhile, Bart gets his ear pierced so he can be cool, but soon discovers that it doesn't work if every kid in school does the same thing."
198,1998-04-05,198,/episode/198.webp,The Trouble with Trillions,9,"Homer (like practically every Springfieldianite who isn't a Flanders) waits until the last minute to file his tax return, and the IRS has jail time in store for Homer — unless Homer plays spy to retrieve a trillion-dollar bill that Mr. Burns was supposed to deliver to post-World War II Europe to pay for reconstruction and stimulate the economy."
