id,airdate,episode_number,image_path,name,season,synopsis
341,2005-01-16,341,/episode/341.webp,Midnight Rx,16,"When Mr. Burns cancels the plant employees' prescription drug plan, Homer chooses to get cheap prescription drugs from Canada (with forged Canadian ID papers), only for Grampa, Ned, and Apu to join him on a second trip, which is not as successful as the first; however, when Smithers is at the brink of death because of a thyroid condition, Burns chooses to finance one final run (it's easier than teaching someone new the filing system) with the help of his plane, ""The Plywood Pelican."""
342,2005-01-30,342,/episode/342.webp,Mommie Beerest,16,"Moe's Tavern is closed by a health inspector, so Homer takes out a mortgage on his house to open the bar again. As a result, Marge becomes Moe's business partner and turns the bar into a British pub that makes them spend too much time together, which worries Homer."
343,2005-02-06,343,/episode/343.webp,Homer and Ned's Hail Mary Pass,16,"Homer starts to teach sport players his dances and is placed in charge of the halftime show of the next Super Bowl. Meanwhile, Ned creates a violent film about Bible stories, which makes Marge angry, so she prevents him from displaying it."
344,2005-02-13,344,/episode/344.webp,Pranksta Rap,16,"Bart fakes his own kidnapping to get out of being punished for going to a rap concert without his parents' permission, but the ruse goes too far when Milhouse's father is implicated as the kidnapper and Chief Wiggum sees this as an opportunity to make a name for himself as a competent police officer."
345,2005-02-20,345,/episode/345.webp,There's Something About Marrying,16,"Gay and lesbian couples are allowed to get married in Springfield and Homer takes advantage of it with a wedding business, marrying several same-sex couples, including Patty, who comes out of the closet as a lesbian."
346,2005-03-06,346,/episode/346.webp,On a Clear Day I Can't See My Sister,16,"Lisa becomes fed up with Bart's teasing and takes out a restraining order against him, while Homer takes a job as a Sprawl-Mart employee."
347,2005-03-13,347,/episode/347.webp,Goo Goo Gai Pan,16,"Selma hits menopause while giving Mr. Burns his road test for a new driver's license and is upset that she won't be able to have children and not die alone. Lisa suggests that Selma adopt a kid, but the only place that has unwanted children looking for loving parents is China, and China doesn't allow single parents to adopt, so Selma puts down Homer's name on the adoption papers, prompting the family to come with her to China, with Selma and Homer pose as a married couple while Marge pretends to be their live-in nanny."
348,2005-03-20,348,/episode/348.webp,Mobile Homer,16,"When Homer is almost killed by the repeatedly closing garage door, Marge insists that he gets health insurance. However, Homer is considered uninsurable. Marge starts saving money by cutting corners, which doesn't work very well when Homer wastes it faster than Marge saves it. Marge insists that she takes charge of the family finances, resulting in Homer using the savings on the down-payment for an RV. Marge has finally undergone too much peer pressure and turns against him, so Homer seeks out some new friends - fellow RV owners, whom he invites to pull into the backyard. However, their problems disappear the next morning; the problem is, so do Bart and Lisa, who plan to drive the RV back to the sales lot."
349,2005-04-03,349,/episode/349.webp,The Seven-Beer Snitch,16,"After Shelbyville accuses Springfield of being hicks, Marge convinces the townspeople to fund a Frank Gehry-designed concert hall, which is then converted to a prison when the concert hall goes bankrupt on opening night. Meanwhile, Bart and Lisa investigate Snowball II's recent weight gain."
350,2005-04-17,350,/episode/350.webp,Future-Drama,16,"Through Professor Frink's future machine, Bart and Lisa see their lives in the year 2013, where Bart steals Lisa's chances at going to an Ivy League school in order to impress a skater girl named Jenda while Homer (now separated from Marge and living in an underwater apartment) fights Krusty the Clown after Marge begins dating him."
351,2005-05-01,351,/episode/351.webp,Don't Fear the Roofer,16,"Homer befriends a roofer named Ray (voiced by Ray Romano), but everyone worries about Homer's sanity when think Ray isn't real."
352,2005-05-01,352,/episode/352.webp,The Heartbroke Kid,16,Springfield Elementary signs a deal with a snack company to install vending machines in the schools—with Bart taking advantage of the situation to the point that he becomes obese and suffers a heart attack.
353,2005-05-08,353,/episode/353.webp,A Star is Torn,16,"After her family falls ill from organic food, Lisa uses her singing voice to comfort them, and Homer sees his daughter's talent as a chance to compete on a reality talent show for kids."
354,2005-05-08,354,/episode/354.webp,Thank God It's Doomsday,16,Homer fears the Biblical end of days is coming after watching a movie and seeing what he thinks are signs of the Apocalypse.
355,2005-05-15,355,/episode/355.webp,Home Away from Homer,16,"Flanders rents a room to two college girls who host a webcam porn site. Upset that no one in town told him this (and that Homer was the one who told everyone), Ned moves to the seemingly perfect town of Humbleton, Pennsylvania, while a brash coach moves into Flanders' house and begins harassing Homer the same way Homer harassed Ned."
356,2005-05-15,356,/episode/356.webp,"The Father, the Son and the Holy Guest Star",16,"When Bart is unjustly expelled for an incident at a medieval-themed fair at school that wasn't his fault, he's sent to a Catholic private school led by an Irish priest who shows Bart and Homer the fun side of the Catholic religion. Naturally, Ned, Marge, and Reverend Lovejoy (who are Protestant) don't agree."
357,2005-09-11,357,/episode/357.webp,The Bonfire of the Manatees,17,"Homer gets into trouble over his football gambling debts and allows the Springfield Mafia to shoot a porno film in the house. In anger, Marge leaves for the beach—and encounters a marine biologist named Caleb (voiced by Alec Baldwin) who has dedicated his life to saving manatees."
358,2005-09-18,358,/episode/358.webp,The Girl Who Slept Too Little,17,"When a graveyard is moved near the Simpson house to make room for a stamp museum, Lisa suddenly has nightmares and learns that even someone as level-headed as her can be scared."
359,2005-09-25,359,/episode/359.webp,Milhouse of Sand and Fog,17,"When Maggie comes down with the chicken pox, Homer actually takes some advice from Flanders and holds a ""pox party"" so his friends could have their kids infected. After one too many ""Marge-aritas"", Kirk and Luann van Houten plan to get back together. However, Milhouse realizes they are too interested in each other and not interested in him, so he tries to break them up by planting a bra in his parents' bedroom. One problem: Luann discovers that it is Marge's bra, which leads to Homer and Marge breaking up yet again."
360,2005-11-06,360,/episode/360.webp,Treehouse of Horror XVI,17,"This year's Halloween episodes include: Kang and Kodos mess with the time/space continuum in order to make Halloween come early this year; Bart teams up with a band of rejected robots after being replaced with a robot boy while in a coma in ""B.I.: Bartifical Intelligence,"" Homer and several ancillary characters are hunted for sport by Mr. Burns in ""Survival of the Fattest,"" and a witch curses costumed townspeople after losing a Halloween contest in ""(I've Grown) A-Costume To Your Face."""
361,2005-11-13,361,/episode/361.webp,Marge's Son Poisoning,17,"Bart fears his spending time with Marge will make him a mama's boy. Meanwhile, Homer gets into arm wrestling."
362,2005-11-20,362,/episode/362.webp,See Homer Run,17,"To win back Lisa's love and keep her from hating men in the future, Homer dresses up as a mascot called ""The Safety Salamander"" and gains fame for rescuing people from a multiple-car pile-up on the freeway. Meanwhile, Springfield holds a recall election to finally get the incompetent Mayor Quimby out of office, and Homer (as The Safety Salamander) decides to run."
363,2005-11-27,363,/episode/363.webp,The Last of the Red Hat Mamas,17,"Homer ruins Marge's chance to make friends and, just when she thinks she will never have friends, a woman called Tammy offers her to join a group called ""The Cheery Red Tomatoes"". Meanwhile, Lisa Simpson wants to learn Italian."
364,2005-12-11,364,/episode/364.webp,The Italian Bob,17,"The Simpsons are going to Italy...to help Mr. Burns retrieve his  new sports car, and end up in an Italian village where Sideshow Bob is now married and has a son."
365,2005-12-18,365,/episode/365.webp,Simpsons Christmas Stories,17,"In this Christmas anthology episode: Homer tells his rendition of Jesus' birth in the manger during a Christmas church service, Grampa tells Lisa about his Christmas fighting in the Pacific theater during World War II, and a parody of The Nutcracker Suite shows everyone in Springfield prepping for the holidays, including Moe's annual suicide and Homer forgetting Marge's present."
366,2006-01-08,366,/episode/366.webp,Homer's Paternity Coot,17,"After a frozen mailman from the 60s is discovered, all the letters he was carrying are delivered to their destinations, including one for Mona Simpson from a man telling her about their son, which suggests Abraham could not be Homer's father. Homer goes to find his true father, someone called Mason Fairbanks."
367,2006-01-29,367,/episode/367.webp,We're on the Road to D'oh-where,17,"Bart gets in trouble for setting off the steam pipes in the school. The punishment: time in a behavioral modification camp in Oregon. Unfortunately, Bart has been put on the ""No Fly"" list, so Homer must sacrifice his Vegas trip with his bar buddies to take Bart to the camp. Meanwhile, Marge and Lisa clean house and hold a garage sale — and Marge inadvertently becomes a drug dealer when everyone in town  begins buying the family's expired medication."
368,2006-02-26,368,/episode/368.webp,My Fair Laddy,17,"Springfield Elementary School has a new gym teacher, Coach Krupt, who plays a game called Bombardment, which consists solely of Krupt knocking the students over with dodgeballs. When an errant solid-ice dodgeball which Bart made to get back at Krupt destroys Groundskeeper Willie's shack and leaves him homeless, the Simpsons take Willie in. Lisa plans to make Willie over into a proper gentleman as a project for the school science fair."
369,2006-03-12,369,/episode/369.webp,The Seemingly Never-Ending Story,17,"On a family outing inside a cave, Homer causes a stalactite to crash into the ground, and he ends up stuck in the hole; while Marge, Bart, and Maggie look for a way out, Lisa stays behind and tells Homer a story about how she was chased by a ram and ended up in Mr. Burns' attic...where he tells the story of how he loses everything to the rich Texan and has to work his way back up from the bottom, starting at Moe's...where he discovers Moe's story of how he met the perfect woman - Mrs. Krabappel - but the only way he could afford to start a new life with her is to steal a bag of gold coins discovered by the archaeologist who would be Snake."
370,2006-03-19,370,/episode/370.webp,Bart Has Two Mommies,17,"Marge babysits Rod and Todd, who are not allowed to do many activities since Ned cares for them too much. Homer takes the kids to an animal shelter, where Bart is kidnapped by a monkey named Toot-Toot."
371,2006-03-26,371,/episode/371.webp,"Homer Simpson, This is Your Wife",17,"Homer puts himself and Marge in a TV show in which two families swap mothers: Homer and the kids get a very strict woman, while Marge stays with that woman's husband, who develops a crush on Marge."
372,2006-04-02,372,/episode/372.webp,Million-Dollar Abie,17,"The commissioner of football is in town to finalize the awarding of a new professional football team to Springfield, but when he gets lost and asks for directions at the Simpson house, Grampa ties him up, leading the commissioner to cancel the team. This results to the townspeople hating Abe to the point where he attempts suicide, but when that doesn't happen, because he chooses to live life to the fullest, starting with being the toreador at the new football-stadium-turned-bullring."
373,2006-04-09,373,/episode/373.webp,Kiss Kiss Bang Bangalore,17,"The Springfield Nuclear Power Plant is moved to India and Homer is chosen to manage the Indian plant, but with all the gifts and praise he gets, he thinks of being a god."
374,2006-04-23,374,/episode/374.webp,The Wettest Stories Ever Told,17,"When the Simpsons' plans for a nice family outing at The Frying Dutchman turns into a dining disaster (due to an uncooperative octopus armed with knives), the family tries to salvage the night by turning the episode into yet another Simpsons anthology show (in the same vein as Tales from the Public Domain, Margical History Tour and Simpsons Christmas Stories, but with a nautical theme)."
375,2006-04-30,375,/episode/375.webp,Girls Just Want to Have Sums,17,"After Principal Skinner gets in trouble for making an off-hand remark about how a former Springfield Elementary School student succeeded, despite being bad at math, a new female principal is hired and segregates the school based on gender. But when Lisa feels that the girls' side isn't doing any real learning, she disguises herself as a boy and goes to the boys' side."
376,2006-05-07,376,/episode/376.webp,Regarding Margie,17,"When Marge bumps her head on a stool by her maximum-strength cleaning solution she uses to clear the house before her free housecleaning (which ""she"" won thanks to Homer painting the address number on the curb in front of the house), she gets amnesia, but quickly remembers everything except for two things - one, that she's married to Homer, and two, who Homer is."
377,2006-05-14,377,/episode/377.webp,The Monkey Suit,17,"After Ned Flanders sees an exhibit on evolution at a museum, he and Reverend Lovejoy talk Principal Skinner into allowing the teaching of creationism in schools. When Lisa complains at a town meeting that there should only be one theory taught in schools, Mayor Quimby agrees - and teaching evolution is banned in schools, so Lisa plans to teach a secret evolution class which gets her arrested. Does Marge have something up where her sleeves would be if she didn't always wear a sleeveless dress to help Lisa?"
378,2006-05-21,378,/episode/378.webp,Marge and Homer Turn a Couple Play,17,"Homer and Marge are chosen by Buck Mitchell, the Springfield Isotopes' star first baseman, to help him sort out his relationship with Tabitha Vixx, a Britney Spears-esque pop singer notorious for her sexualized performances."
379,2006-09-10,379,/episode/379.webp,"The Mook, the Chef, the Wife and Her Homer",18,"At school, Lisa befriends Fat Tony's son. Fat Tony is put out of commission by a rival society, and Homer and Bart take over running mob operations, when Michael, who says of being nothing like his father, is not interested in the “family business.”"
380,2006-09-17,380,/episode/380.webp,Jazzy and the Pussycats,18,"Bart plays the drums following a counselor's suggestion. He is very good at it, and is asked by a rock group to become a member of their band, something that has been Lisa's dream for a long time."
381,2006-09-24,381,/episode/381.webp,"Please Homer, Don't Hammer 'Em",18,"Marge becomes interested in carpentry, but uses Homer as the face of her operation, since no one in town thinks women are good enough to be carpenters. Meanwhile, Springfield Elementary School bans all peanut products due to fear of food allergies — until Bart discovers that the one with the peanut allergy is Principal Skinner."
382,2006-11-05,382,/episode/382.webp,Treehouse of Horror XVII,18,"In ""Married to the Blob"", Homer eats green extraterrestrial goo and morphs into a rampaging blob with an insatiable appetite; in ""You Gotta Know When to Golem"", Bart finds a golem (a clay man from Jewish mythology that does whatever is told of it through written scrolls inserted in its mouth) and uses it to play pranks and be destructive; and in ""The Day the Earth Looked Stupid,"" the residents of early-1930s Springfield refuse to believe news of an actual alien invasion after being duped by Orson Welles's ""War of the Worlds"" broadcast."
383,2006-11-12,383,/episode/383.webp,G.I. D'oh,18,"Bart joins the army after recruiters visit the school, so Homer takes his place. After he escapes with all the other soldiers, the colonel invades Springfield in a hunt to locate him."
384,2006-11-19,384,/episode/384.webp,Moe'N'a Lisa,18,"Lisa turns Moe's notes of an obscure world into a poem, so he is invited to a writer's convention by Tom Wolfe, but he says that it is his own work, which breaks Lisa's heart."
385,2006-11-26,385,/episode/385.webp,Ice Cream of Margie (with the Light Blue Hair),18,Homer gets a job as an ice cream seller and Marge uses the ice creams sticks to make sculptures of people in Springfield and becomes famous.
386,2006-12-10,386,/episode/386.webp,The Haw-Hawed Couple,18,"Nelson invites Bart's classmates to his birthday party, but Bart and Martin convince the other kids not to go. Bart is forced to attend Nelson's party by Marge, and Bart becomes friends with Nelson."
387,2006-12-17,387,/episode/387.webp,"Kill Gil, Volumes I & II",18,"The Simpsons let Gil stay with them during Christmas. However, he stays for eleven months because Marge can't tell him ""no""."
388,,388,/episode/388.webp,The Wife Aquatic,18,"During an outdoor movie event, Marge remembers of going to Barnacle Bay, an island she visited in childhood. Homer takes her there, but when the family arrives they discover it has become positively poor."
389,2007-01-28,389,/episode/389.webp,Revenge is a Dish Best Served Three Times,18,"When a motorist cuts Homer off and he swears revenge on the driver, Marge, Lisa, and Bart tell legends of revenge:"
390,2007-02-11,390,/episode/390.webp,Little Big Girl,18,"After unwittingly saving Springfield from an out-of-control fire, Bart is rewarded with a driving license. However, he gets bushed of driving Homer everywhere, so he goes on the run and has a relationship with an older girl named Darcy. Meanwhile, Lisa invents a pretend Native American tribe for her school report and claims to be a descendant of it. The statement snowballs to a dramatic conclusion."
391,2007-02-18,391,/episode/391.webp,Springfield Up,18,"Declan Desmond films a documentary about the lives of people of Springfield and how they changed over the years. Homer makes him believe he is rich, but he actually took Burns Manor while Mr. Burns was out."
392,2007-03-04,392,/episode/392.webp,Yokel Chords,18,"Lisa teaches the Spuckler children about culture, and soon Krusty hires them to act on his show. They become famous and earn a lot of money, but Cletus exploits them and spends the money for himself."
393,2007-03-11,393,/episode/393.webp,Rome-Old and Julie-Eh,18,"When Homer declares bankruptcy (under the impression that it would protect his assets), he has to cut wasteful spending, so he stops paying for Grampa to stay in the Springfield Retirement Castle, causing him to move out - and move into a relationship with Selma, despite the objections of Homer and Patty. Meanwhile Bart and Lisa order shipping materials from a delivery company and the company discovers they built a fort with them, it is an all-out war of paper products."
394,,394,/episode/394.webp,Homerazzi,18,"Homer becomes a tabloid photographer and takes photos of famous people, but they start to get irritated so they send a photographer who will take pictures of Homer's most humiliating moments."
395,2007-04-22,395,/episode/395.webp,Marge Gamer,18,"Marge discovers the Internet and gets hooked on an online fantasy role-playing game called Earthland Realms, where she interacts with practically everyone in Springfield, including Bart, whose online persona is the local tough guy, the Shadow Knight. Meanwhile, Homer becomes a soccer referee, which strains his and Lisa's relationship when he has to call penalties on her."
396,2007-04-29,396,/episode/396.webp,The Boys of Bummer,18,"The Springfield Isotots win a Little League championship game, but when Bart makes an error that costs the team the championship, the townspeople refuse to let him forget it. Meanwhile, Homer's attempts to talk his way out of being caught sleeping in a department store bed end up selling the mattress, so he ends up as a mattress salesman, but he has second thoughts when Reverend Lovejoy trades Homer's mattress for the one he just bought."
397,2007-05-06,397,/episode/397.webp,Crook and Ladder,18,"Homer, Moe, Apu and Principal Skinner become volunteer firefighters. But just because the boys are not getting their salary doesn't mean that they can't find a way to receive compensation."
398,2007-05-13,398,/episode/398.webp,"Stop, or My Dog Will Shoot!",18,"When Homer gets lost in a cornfield maze, Santa's Little Helper comes to the rescue, sending the hound to animal police academy. However, when he bites Bart rather than play catch with him, Bart gets a new pet - a snake - which gets loose in the school."
399,2007-05-20,399,/episode/399.webp,24 Minutes,18,"In a parody of 24, Bart and Lisa join forces to prevent the bullies from setting off a stink bomb at the school bake sale, and the pair gets help by many different students, including Martin."
400,2007-05-20,400,/episode/400.webp,You Kent Always Say What You Want,18,"In this, the 400th episode (both in production and broadcast order), Kent Brockman gets in trouble for swearing on live TV after Homer spills hot coffee on Brockman's lap during a live interview. After he loses his job for allegedly flavoring his coffee with cocaine, Brockman becomes The Simpsons' latest house guest. While there, he tells Lisa the real reason why the FCC issues fines for indecent content on TV and the two team up to take down the mainstream media by posting the bombshell on YouTube."
401,2007-09-23,401,/episode/401.webp,He Loves to Fly and He D'ohs,19,"Homer Simpson gets to fly in Charles Montgomery Burns' private jet and likes it so much that he plans to never fly commercial again. He tries to find a job that involves flying in a corporate jet, and hires a life coach named Colby Krause to assist him with his goal."
402,2007-09-30,402,/episode/402.webp,The Homer of Seville,19,"After an injury at a funeral, Homer finds out that he can sing very well while being laid down, and joins the opera."
403,2007-10-07,403,/episode/403.webp,Midnight Towboy,19,"Matt Dillon guest voices as a tow truck driver in nearby Guidopolis who tows Homer's car (while he is searching for some milk for Maggie, who has become a little too clingy to Marge until Marge hires someone who persuades her into letting Maggie become independent) and ends up selling Homer a tow truck, but when Homer tows away a few too many of his friends' cars, they come up with a solution that results in Homer being put out of business...and possibly out of existence."
404,2007-10-14,404,/episode/404.webp,I Don't Wanna Know Why the Caged Bird Sings,19,"Steve Buscemi guest voices as a bank robber who holds Marge hostage during a robbery, only to give himself up when she promises to visit him in prison (since his mother abandoned him at an amusement park when he was a child), but when Marge finds excuses not to talk to him, much less visit him, he escapes and confronts Marge...and makes her take him to the same park."
405,2007-11-04,405,/episode/405.webp,Treehouse of Horror XVIII,19,"E.T., Go Home - In this spoof of E.T.: The Extraterrestrial,  Bart discovers Kodos hiding in the Simpsons' backyard, where Kodos tells him and Lisa to get equipment for contacting someone to pick him up, but in reality he is setting Earth up for an invasion."
406,2007-11-11,406,/episode/406.webp,Little Orphan Millie,19,"When Kirk and Luann remarry and go on a honeymoon cruise, they topple into the sea and are presumed dead. Milhouse turns into a real man following the loss of his parents - making him more popular than ever. Bart contacts Milhouse's uncle in a bid to regain his popularity, only to realize how much he is close to his best friend when he plans on leaving. Meanwhile, Homer finds himself in trouble when he can't remember Marge's eye color."
407,2007-11-18,407,/episode/407.webp,Husbands and Knives,19,"Marge forms a new women-only gymnasium and Homer becomes worried about losing her after she becomes a highly successful businesswoman. Meanwhile, Coolsville, a new comic book shop, opens in Springfield and puts Comic Book Guy out of business."
408,2007-11-25,408,/episode/408.webp,Funeral for a Fiend,19,"Marge sees a commercial for a new barbecue rib restaurant that turns out to be a trap set by Sideshow Bob. Once again, the trap fails and Bob is arrested, but at his trial, Bart throws away a nitroglycerin vial that Bob needed for his heart condition, leaving him to supposedly die."
409,2007-12-16,409,/episode/409.webp,Eternal Moonshine of the Simpson Mind,19,"Homer wakes up to find himself outdoors and covered with snow, without any memory of the evening before. When he arrives home, he finds out that everyone is missing. Seeking help from Moe and Professor Frink, Homer tries to piece together his memory to find out what happened to him."
410,2008-01-06,410,/episode/410.webp,E. Pluribus Wiggum,19,"Springfield becomes the site of the first presidential primary. The townspeople soon get sick of all of the presidential candidates sucking up to them, and plan to support their own write-in candidate: Ralph Wiggum."
